{
  "$schema": "http://json-schema.org/draft-07/schema#",
  "type": "object",
  "properties": {
    "name": { "type": "string" },
    "title": { "type": "string" },
    "tagline": { "type": "string" },
    "bio": { "type": "string" },
    "location": { "type": "string" },
    "availability": { "type": "string" },
    "contact": {
      "type": "object",
      "properties": {
        "email": { "type": "string", "format": "email" },
        "phone": { "type": "string" }
      },
      "required": ["email"]
    },
    "socialLinks": {
      "type": "array",
      "items": {
        "type": "object",
        "properties": {
          "name": { "type": "string" },
          "url": { "type": "string", "format": "uri" },
          "icon": { "type": "string" }
        },
        "required": ["name", "url", "icon"]
      }
    }
  },
  "required": ["name", "title", "contact", "socialLinks"]
}